{
  "candidate_id": "CC-103",
  "evidence_id": "EV-103",
  "title": "Sample Exchange Announcement",
  "symbols": [
    "SAMPLE"
  ],
  "tags": [
    "sample",
    "exchange"
  ],
  "source": "https://example.test/exchange/ev-103",
  "generated_at": "2026-06-28T15:39:44.963679+00:00",
  "status": "Candidate",
  "confidence": null,
  "grade": null,
  "review_required": true,
  "model_impact": "repository_only"
}
