{
  "candidate_id": "CC-102",
  "evidence_id": "EV-102",
  "title": "Sample Macro Event",
  "symbols": [],
  "tags": [
    "sample",
    "macro"
  ],
  "source": "https://example.test/macro/ev-102",
  "generated_at": "2026-06-28T15:39:44.963679+00:00",
  "status": "Candidate",
  "confidence": null,
  "grade": null,
  "review_required": true,
  "model_impact": "repository_only"
}
